{
  "schema_version": "1.0.0", "cluster_id": "culture-static-dynamic-societies", "title": "Culture, memes, and static or dynamic societies", "status": "active", "application_policy": "source-only",
  "domains": ["culture-and-institutions", "evolution"], "explanation_levels": ["institutional", "emergent"],
  "aliases": ["memes", "rational memes", "anti-rational memes", "static society", "dynamic society", "evolution of culture"], "source_routes": ["source.boi.2011.allen-lane"],
  "problem": {"id": "problem.culture.preserve-or-correct.v1", "summary": "How do cultures reproduce complex ideas, and why do some preserve content by suppressing criticism while others sustain change?", "origin": {"representation": "editorial-synthesis", "represents": "skill-editor"}, "source_refs": [], "routing": {"reasoning_jobs": ["understand-worldview", "evaluate-explanation", "criticize", "source-check"], "keywords": ["culture", "meme", "static society", "dynamic society", "anti-rational", "tradition", "dissent", "criticism"], "structural_predicates": ["A culture preserves ideas by discouraging variation or criticism.", "A person or organization is being labeled anti-rational from disagreement alone.", "Cultural transmission is treated as literal copying without creative reconstruction."], "reject_if": ["which employee should I fire", "diagnose this person"], "diagnostic_questions": ["What mechanism reproduces the idea?", "Does persistence depend on criticism or on disabling it?", "What evidence would distinguish an ideal type from a label?"]}},
  "definitions": [],
  "claims": [{"id": "claim.culture.rational-antirational.v1", "summary": "Deutsch distinguishes cultural ideas that reproduce through critical improvement from those that reproduce partly by disabling criticism, and connects their prevalence to static and dynamic forms of society.", "kind": "explanatory-theory", "scope": "domain-bounded", "transfer_policy": "non-transferable", "origin": {"representation": "faithful-paraphrase", "represents": "david-deutsch"}, "source_refs": [{"source_id": "source.boi.2011.allen-lane", "locator": "chapter 15, lines 3641-3849 and summary lines 3849-3854", "verification": "checked"}], "lineage": "claim.culture.rational-antirational", "version": 1, "lifecycle": "active"}],
  "arguments": [{"id": "argument.culture.two-replication-strategies.v1", "stance": "for", "summary": "Cultural ideas must cause behavior that reconstructs the idea in another mind; Deutsch groups successful strategies around helping holders or inhibiting their criticism.", "conclusions": ["claim.culture.rational-antirational.v1"], "origin": {"representation": "faithful-paraphrase", "represents": "david-deutsch"}, "source_refs": [{"source_id": "source.boi.2011.allen-lane", "locator": "chapter 15 summary, lines 3849-3854", "verification": "checked"}]}],
  "examples": [],
  "criticisms": [{"id": "criticism.culture.no-actor-diagnosis.v1", "stance": "qualifies", "summary": "These are philosophical explanatory categories, not validated personnel diagnostics or a binary culture score; disagreement and tradition alone do not establish anti-rational replication.", "conclusions": ["claim.culture.rational-antirational.v1"], "origin": {"representation": "editorial-synthesis", "represents": "skill-editor"}, "source_refs": []}],
  "relationships": [
    {"id": "rel.culture.claim-addresses.v1", "type": "addresses", "from": "claim.culture.rational-antirational.v1", "to": "problem.culture.preserve-or-correct.v1", "origin": {"representation": "faithful-paraphrase", "represents": "david-deutsch"}, "source_refs": [{"source_id": "source.boi.2011.allen-lane", "locator": "chapter 15, lines 3641-3854", "verification": "checked"}]},
    {"id": "rel.culture.argument-argues-for.v1", "type": "argues_for", "from": "argument.culture.two-replication-strategies.v1", "to": "claim.culture.rational-antirational.v1", "origin": {"representation": "faithful-paraphrase", "represents": "david-deutsch"}, "source_refs": [{"source_id": "source.boi.2011.allen-lane", "locator": "chapter 15 summary, lines 3849-3854", "verification": "checked"}]},
    {"id": "rel.culture.diagnosis-qualifies.v1", "type": "qualifies", "from": "criticism.culture.no-actor-diagnosis.v1", "to": "claim.culture.rational-antirational.v1", "origin": {"representation": "editorial-synthesis", "represents": "skill-editor"}, "source_refs": []}
  ],
  "boundaries": {"misreadings": ["An opponent is an anti-rational meme carrier.", "Every society or company can be scored static or dynamic.", "Memes are copied without inference or creativity."], "not_for": ["personnel diagnosis", "firing advice", "culture ranking", "political labeling"], "decline_if": ["The requested use is an actionable diagnosis of a person or institution."]}
}
