{
  "schema_version": "1.0.0", "cluster_id": "sustainability-and-unforeseen-problems", "title": "Sustainability and unforeseen problems", "status": "active",
  "domains": ["worldview", "culture-and-institutions", "general-problem-solving"], "explanation_levels": ["worldview-meta", "institutional"],
  "aliases": ["unsustainable", "sustainability", "unforeseen problems", "preparing for disasters", "static societies fail"], "source_routes": ["source.boi.2011.allen-lane"],
  "problem": {"id": "problem.future.unforeseeable-threats.v1", "summary": "How can a civilization prepare for threats it cannot predict, and why is stasis not a durable safety strategy?", "origin": {"representation": "editorial-synthesis", "represents": "skill-editor"}, "source_refs": [], "routing": {"reasoning_jobs": ["evaluate-progress", "design-error-correction", "criticize"], "keywords": ["sustainability", "disaster", "future", "unforeseen", "risk", "stasis", "catastrophe", "resilience"], "structural_predicates": ["Safety is equated with preventing all foreseeable change.", "A fixed list of predicted disasters is treated as complete.", "Progress rhetoric is used to discard present risk controls."], "reject_if": ["no caveats", "ignore safety"], "diagnostic_questions": ["Which correction capabilities work across unpredicted problems?", "What present safeguards remain warranted?", "Does the strategy preserve knowledge creation or merely freeze current arrangements?"]}},
  "definitions": [],
  "claims": [{"id": "claim.future.stasis-cannot-secure.v1", "summary": "Static societies eventually encounter problems they cannot solve; prediction-specific prevention cannot cover the unforeseeable, so long-run resilience depends on rapid knowledge creation and error correction.", "kind": "explanatory-theory", "scope": "domain-bounded", "transfer_policy": "bridge-required", "origin": {"representation": "faithful-paraphrase", "represents": "david-deutsch"}, "source_refs": [{"source_id": "source.boi.2011.allen-lane", "locator": "chapter 17 summary, lines 4172-4177", "verification": "checked"}], "lineage": "claim.future.stasis-cannot-secure", "version": 1, "lifecycle": "active"}],
  "arguments": [{"id": "argument.future.unforeseen-defeats-fixed-plan.v1", "stance": "for", "summary": "A strategy optimized only for currently foreseeable disasters cannot address classes of future problems that have not yet been conceived.", "conclusions": ["claim.future.stasis-cannot-secure.v1"], "origin": {"representation": "faithful-paraphrase", "represents": "david-deutsch"}, "source_refs": [{"source_id": "source.boi.2011.allen-lane", "locator": "chapter 17, Unsustainable, lines 4007-4177", "verification": "checked"}]}],
  "examples": [],
  "criticisms": [{"id": "criticism.future.not-recklessness.v1", "stance": "qualifies", "summary": "Open-ended progress does not make foreseeable risk controls, conservation, redundancy, or contingency planning irrational; these require target-domain evidence rather than philosophy alone.", "conclusions": ["claim.future.stasis-cannot-secure.v1"], "origin": {"representation": "editorial-synthesis", "represents": "skill-editor"}, "source_refs": []}],
  "relationships": [
    {"id": "rel.future.claim-addresses.v1", "type": "addresses", "from": "claim.future.stasis-cannot-secure.v1", "to": "problem.future.unforeseeable-threats.v1", "origin": {"representation": "faithful-paraphrase", "represents": "david-deutsch"}, "source_refs": [{"source_id": "source.boi.2011.allen-lane", "locator": "chapter 17, lines 4007-4177", "verification": "checked"}]},
    {"id": "rel.future.argument-argues-for.v1", "type": "argues_for", "from": "argument.future.unforeseen-defeats-fixed-plan.v1", "to": "claim.future.stasis-cannot-secure.v1", "origin": {"representation": "faithful-paraphrase", "represents": "david-deutsch"}, "source_refs": [{"source_id": "source.boi.2011.allen-lane", "locator": "chapter 17, lines 4007-4177", "verification": "checked"}]},
    {"id": "rel.future.recklessness-qualifies.v1", "type": "qualifies", "from": "criticism.future.not-recklessness.v1", "to": "claim.future.stasis-cannot-secure.v1", "origin": {"representation": "editorial-synthesis", "represents": "skill-editor"}, "source_refs": []}
  ],
  "boundaries": {"misreadings": ["Progress makes risk management unnecessary.", "Conservation is always static-society thinking.", "A known danger may be ignored because future knowledge will solve it."], "not_for": ["discarding safeguards", "predicting technological rescue"], "decline_if": ["The task is a concrete safety assessment without relevant domain evidence."]}
}
