{
  "schema_version": "1.0.0", "cluster_id": "optimism-problems-progress", "title": "Optimism, problems, and progress", "status": "active",
  "domains": ["epistemology", "general-problem-solving", "morality"], "explanation_levels": ["worldview-meta", "epistemic-method"],
  "aliases": ["optimism", "rational optimism", "problems are soluble", "problems are inevitable", "progress"], "source_routes": ["source.boi.2011.allen-lane"],
  "problem": {"id": "problem.optimism.unknown-solutions.v1", "summary": "How can it be rational to work on problems whose solutions and future obstacles cannot yet be predicted?", "origin": {"representation": "editorial-synthesis", "represents": "skill-editor"}, "source_refs": [], "routing": {"reasoning_jobs": ["understand-worldview", "evaluate-progress", "generate-conjectures", "design-error-correction"], "keywords": ["optimism", "hopeless", "impossible", "problem", "solution", "progress", "evil", "setback"], "structural_predicates": ["A hard problem is treated as unlikely to be solved merely because no solution is known.", "Optimism is invoked as confidence in a schedule or outcome.", "A failure is treated as an endpoint rather than a new problem situation."], "reject_if": ["request for probability guarantee"], "diagnostic_questions": ["What knowledge is missing?", "Which error-correcting process can create it?", "What new problems would success itself create?"]}},
  "definitions": [],
  "claims": [{"id": "claim.optimism.failures-insufficient-knowledge.v1", "summary": "Optimism is the theory that failures and evils are due to insufficient knowledge; problems are inevitable, while particular problems are soluble through creating knowledge.", "kind": "explanatory-theory", "scope": "universal", "transfer_policy": "same-context", "origin": {"representation": "faithful-paraphrase", "represents": "david-deutsch"}, "source_refs": [{"source_id": "source.boi.2011.allen-lane", "locator": "chapter 9 summary, lines 1929-1934", "verification": "checked"}], "lineage": "claim.optimism.failures-insufficient-knowledge", "version": 1, "lifecycle": "active"}],
  "arguments": [{"id": "argument.optimism.knowledge-unbounded.v1", "stance": "for", "summary": "If knowledge creation has no fixed domain ceiling, the absence of a present solution does not imply that a solution is fundamentally unavailable.", "conclusions": ["claim.optimism.failures-insufficient-knowledge.v1"], "origin": {"representation": "faithful-paraphrase", "represents": "david-deutsch"}, "source_refs": [{"source_id": "source.boi.2011.allen-lane", "locator": "chapter 9, Optimism, lines 1744-1928", "verification": "checked"}]}],
  "examples": [],
  "criticisms": [{"id": "criticism.optimism.not-guarantee.v1", "stance": "qualifies", "summary": "The doctrine does not say a solution is already known, will arrive on time, or makes contingency planning unnecessary; failure remains possible when knowledge is not created.", "conclusions": ["claim.optimism.failures-insufficient-knowledge.v1"], "origin": {"representation": "editorial-synthesis", "represents": "skill-editor"}, "source_refs": []}],
  "relationships": [
    {"id": "rel.optimism.claim-addresses.v1", "type": "addresses", "from": "claim.optimism.failures-insufficient-knowledge.v1", "to": "problem.optimism.unknown-solutions.v1", "origin": {"representation": "faithful-paraphrase", "represents": "david-deutsch"}, "source_refs": [{"source_id": "source.boi.2011.allen-lane", "locator": "chapter 9, lines 1744-1934", "verification": "checked"}]},
    {"id": "rel.optimism.argument-argues-for.v1", "type": "argues_for", "from": "argument.optimism.knowledge-unbounded.v1", "to": "claim.optimism.failures-insufficient-knowledge.v1", "origin": {"representation": "faithful-paraphrase", "represents": "david-deutsch"}, "source_refs": [{"source_id": "source.boi.2011.allen-lane", "locator": "chapter 9, lines 1744-1928", "verification": "checked"}]},
    {"id": "rel.optimism.guarantee-qualifies.v1", "type": "qualifies", "from": "criticism.optimism.not-guarantee.v1", "to": "claim.optimism.failures-insufficient-knowledge.v1", "origin": {"representation": "editorial-synthesis", "represents": "skill-editor"}, "source_refs": []}
  ],
  "boundaries": {"misreadings": ["Optimism is cheerfulness.", "Every problem already has a solution.", "A desired result is guaranteed on schedule.", "Victims are to blame for missing knowledge."], "not_for": ["probability estimates", "blame allocation", "discarding contingency plans"], "decline_if": ["The user only wants reassurance."]}
}
