{
  "schema_version": "1.0.0", "cluster_id": "quantum-multiverse", "title": "Quantum interference and the multiverse", "status": "active", "application_policy": "source-only",
  "domains": ["quantum-physics"], "explanation_levels": ["fundamental-physical"],
  "aliases": ["multiverse", "many worlds", "parallel universes", "quantum interference", "Everett"], "source_routes": ["source.for.1997.penguin", "source.boi.2011.allen-lane", "source.multiverse.2001.arxiv-v1", "source.et.2015.arxiv"],
  "problem": {"id": "problem.quantum.interference-reality.v1", "summary": "What underlying physical reality does Deutsch argue explains interference phenomena that a single classical universe cannot?", "origin": {"representation": "editorial-synthesis", "represents": "skill-editor"}, "source_refs": [], "routing": {"reasoning_jobs": ["understand-worldview", "evaluate-explanation", "source-check", "criticize"], "keywords": ["quantum", "multiverse", "parallel universe", "many worlds", "Everett", "interference", "probability"], "structural_predicates": ["The user asks for Deutsch's quantum explanation or its status.", "The multiverse is invoked to deny practical loss or risk.", "An argument for Everett is presented as settled proof or consensus."], "reject_if": ["organize parallel teams", "all outcomes happen so loss is unreal"], "diagnostic_questions": ["Which interference phenomenon and explanatory rival are at issue?", "Is the claim Deutsch's argument, an experimental result, or field consensus?", "Has a physics claim been converted into a non-physics conclusion?"]}},
  "definitions": [],
  "claims": [{"id": "claim.quantum.multiverse-explanation.v1", "summary": "Deutsch argues that interference phenomena require a multiverse of interacting quantum histories and that a single observed universe is an emergent, approximate part of that reality.", "kind": "explanatory-theory", "scope": "domain-bounded", "transfer_policy": "non-transferable", "origin": {"representation": "faithful-paraphrase", "represents": "david-deutsch"}, "source_refs": [{"source_id": "source.for.1997.penguin", "locator": "chapter 2 summary, lines 1677-1690; chapter 11 route", "verification": "checked"}, {"source_id": "source.multiverse.2001.arxiv-v1", "locator": "arXiv quant-ph/0104033v1 abstract and introductory structure", "verification": "checked"}], "lineage": "claim.quantum.multiverse-explanation", "version": 1, "lifecycle": "active"}],
  "arguments": [{"id": "argument.quantum.interference-rules-out-single.v1", "stance": "for", "summary": "Deutsch's chain of reasoning from single-particle interference treats effects attributed to unobserved alternatives as evidence against the visible universe being the whole of reality.", "conclusions": ["claim.quantum.multiverse-explanation.v1"], "origin": {"representation": "faithful-paraphrase", "represents": "david-deutsch"}, "source_refs": [{"source_id": "source.for.1997.penguin", "locator": "chapter 2, Shadows, lines 1036-1690", "verification": "checked"}]}],
  "examples": [],
  "criticisms": [{"id": "criticism.quantum.argument-not-consensus.v1", "stance": "qualifies", "summary": "This packet represents Deutsch's explanatory argument; it does not label Everettian quantum theory experimentally confirmed, uniquely rational by consensus, or a source of advice outside physics.", "conclusions": ["claim.quantum.multiverse-explanation.v1"], "origin": {"representation": "editorial-synthesis", "represents": "skill-editor"}, "source_refs": []}, {"id": "criticism.quantum.tests-are-an-argument.v1", "stance": "qualifies", "summary": "Deutsch's 2015 Everett paper presents an argument about the logic of experimental testing; its existence is not itself a report that Everettian theory has been experimentally proved.", "conclusions": ["claim.quantum.multiverse-explanation.v1"], "origin": {"representation": "faithful-paraphrase", "represents": "david-deutsch"}, "source_refs": [{"source_id": "source.et.2015.arxiv", "locator": "arXiv:1508.02048 abstract, v1-v3 record", "verification": "checked"}]}],
  "relationships": [
    {"id": "rel.quantum.claim-addresses.v1", "type": "addresses", "from": "claim.quantum.multiverse-explanation.v1", "to": "problem.quantum.interference-reality.v1", "origin": {"representation": "faithful-paraphrase", "represents": "david-deutsch"}, "source_refs": [{"source_id": "source.for.1997.penguin", "locator": "chapter 2, lines 1036-1690", "verification": "checked"}]},
    {"id": "rel.quantum.argument-argues-for.v1", "type": "argues_for", "from": "argument.quantum.interference-rules-out-single.v1", "to": "claim.quantum.multiverse-explanation.v1", "origin": {"representation": "faithful-paraphrase", "represents": "david-deutsch"}, "source_refs": [{"source_id": "source.for.1997.penguin", "locator": "chapter 2, lines 1036-1690", "verification": "checked"}]},
    {"id": "rel.quantum.consensus-qualifies.v1", "type": "qualifies", "from": "criticism.quantum.argument-not-consensus.v1", "to": "claim.quantum.multiverse-explanation.v1", "origin": {"representation": "editorial-synthesis", "represents": "skill-editor"}, "source_refs": []},
    {"id": "rel.quantum.tests-qualify.v1", "type": "qualifies", "from": "criticism.quantum.tests-are-an-argument.v1", "to": "claim.quantum.multiverse-explanation.v1", "origin": {"representation": "faithful-paraphrase", "represents": "david-deutsch"}, "source_refs": [{"source_id": "source.et.2015.arxiv", "locator": "arXiv:1508.02048 abstract, v1-v3 record", "verification": "checked"}]}
  ],
  "boundaries": {"misreadings": ["Quantum computers proved many worlds.", "All outcomes occur, so losses are unreal.", "Parallel universes justify parallel business teams."], "not_for": ["finance", "management metaphor", "career choice", "consensus claims"], "decline_if": ["The requested inference leaves quantum physics."]}
}
