{
  "schema_version": "1.0.0", "cluster_id": "objective-morality-and-aesthetics", "title": "Objective progress in morality and aesthetics", "status": "active", "application_policy": "source-only",
  "domains": ["morality", "aesthetics", "epistemology"], "explanation_levels": ["domain-theory", "worldview-meta"],
  "aliases": ["objective morality", "moral realism", "objective beauty", "aesthetics", "flowers beautiful"], "source_routes": ["source.boi.2011.allen-lane"],
  "problem": {"id": "problem.values.disagreement-objectivity.v1", "summary": "Does disagreement or lack of derivation from observation make moral and aesthetic progress merely subjective?", "origin": {"representation": "editorial-synthesis", "represents": "skill-editor"}, "source_refs": [], "routing": {"reasoning_jobs": ["understand-worldview", "evaluate-explanation", "criticize", "source-check"], "keywords": ["morality", "moral", "objective", "beauty", "aesthetic", "flowers", "values", "right wrong"], "structural_predicates": ["Persistent disagreement is treated as proof that no objective improvement is possible.", "Moral realism is used to infer a detailed policy position Deutsch did not state.", "Aesthetic objectivity is used as a taste oracle."], "reject_if": ["tell me the objectively correct policy", "choose my paint color"], "diagnostic_questions": ["What explanatory problem would a better moral or aesthetic theory solve?", "Which concrete conclusion is sourced rather than inferred?", "What criticism could improve the proposed standard?"]}},
  "definitions": [],
  "claims": [{"id": "claim.values.objective-progress.v1", "summary": "Deutsch argues that objective truth and progress are possible in morality and aesthetics, and that disagreements are addressed by seeking better explanations rather than by treating values as arbitrary.", "kind": "conjecture", "scope": "domain-bounded", "transfer_policy": "non-transferable", "origin": {"representation": "faithful-paraphrase", "represents": "david-deutsch"}, "source_refs": [{"source_id": "source.boi.2011.allen-lane", "locator": "introduction, lines 116-126; chapter 9 summary, lines 1929-1934; chapter 14 summary, lines 3633-3638", "verification": "checked"}], "lineage": "claim.values.objective-progress", "version": 1, "lifecycle": "active", "epistemic_status": "contested-conjecture"}],
  "arguments": [{"id": "argument.aesthetics.flowers.v1", "stance": "for", "summary": "The flower case is offered as evidence that convergent standards of beauty can arise across purposes and therefore merit objective explanation.", "conclusions": ["claim.values.objective-progress.v1"], "origin": {"representation": "faithful-paraphrase", "represents": "david-deutsch"}, "source_refs": [{"source_id": "source.boi.2011.allen-lane", "locator": "chapter 14, Why are Flowers Beautiful?, lines 3509-3638", "verification": "checked"}]}],
  "examples": [],
  "criticisms": [{"id": "criticism.values.no-decision-procedure.v1", "stance": "qualifies", "summary": "The sources do not supply a reliable procedure for settling every moral policy or aesthetic choice; the flower argument is evidence within a conjectural theory, not a proof of a complete aesthetics.", "conclusions": ["claim.values.objective-progress.v1"], "origin": {"representation": "editorial-synthesis", "represents": "skill-editor"}, "source_refs": []}],
  "relationships": [
    {"id": "rel.values.claim-addresses.v1", "type": "addresses", "from": "claim.values.objective-progress.v1", "to": "problem.values.disagreement-objectivity.v1", "origin": {"representation": "faithful-paraphrase", "represents": "david-deutsch"}, "source_refs": [{"source_id": "source.boi.2011.allen-lane", "locator": "introduction and chapters 9 and 14", "verification": "checked"}]},
    {"id": "rel.values.flowers-argues-for.v1", "type": "argues_for", "from": "argument.aesthetics.flowers.v1", "to": "claim.values.objective-progress.v1", "origin": {"representation": "faithful-paraphrase", "represents": "david-deutsch"}, "source_refs": [{"source_id": "source.boi.2011.allen-lane", "locator": "chapter 14, lines 3509-3638", "verification": "checked"}]},
    {"id": "rel.values.procedure-qualifies.v1", "type": "qualifies", "from": "criticism.values.no-decision-procedure.v1", "to": "claim.values.objective-progress.v1", "origin": {"representation": "editorial-synthesis", "represents": "skill-editor"}, "source_refs": []}
  ],
  "boundaries": {"misreadings": ["Moral realism entails Deutsch's view on every policy.", "Objective aesthetics tells the user which design to prefer.", "The flower argument proves a complete theory of beauty."], "not_for": ["invented policy platform", "taste oracle", "medical or legal decisions"], "decline_if": ["The requested concrete verdict lacks direct source evidence and target-domain argument."]}
}
