{
  "schema_version": "1.0.0", "cluster_id": "people-creativity-and-agi", "title": "People, creativity, and AGI", "status": "active",
  "domains": ["people-and-creativity", "artificial-intelligence", "epistemology"], "explanation_levels": ["emergent", "domain-theory"],
  "aliases": ["universal explainers", "people", "creativity", "artificial creativity", "agi", "artificial general intelligence"], "source_routes": ["source.boi.2011.allen-lane"],
  "problem": {"id": "problem.creativity.new-explanations.v1", "summary": "What distinguishes general intelligence and creativity from prediction, imitation, optimization, or a bounded repertoire?", "origin": {"representation": "editorial-synthesis", "represents": "skill-editor"}, "source_refs": [], "routing": {"reasoning_jobs": ["understand-worldview", "evaluate-explanation", "source-check", "assess-transfer"], "keywords": ["person", "people", "creativity", "creative", "agi", "llm", "intelligence", "imitation", "new knowledge"], "structural_predicates": ["Fluent imitation is treated as proof of explanation creation.", "A dated claim about AI is silently updated to a present system.", "Creativity is reduced to artistic novelty or search over existing options."], "reject_if": ["current benchmark comparison only"], "diagnostic_questions": ["Is the system creating new explanatory knowledge or producing behavior compatible with it?", "Which source date and capability claim are being used?", "What would distinguish a universal explainer from a bounded generator?"]}},
  "definitions": [],
  "claims": [{"id": "claim.creativity.explanation-making.v1", "summary": "Human creativity is a general capacity to create explanatory knowledge; Deutsch's 2011 treatment argues that AGI progress depends on understanding that creativity rather than merely scaling a bounded technique.", "kind": "explanatory-theory", "scope": "domain-bounded", "transfer_policy": "same-context", "origin": {"representation": "faithful-paraphrase", "represents": "david-deutsch"}, "source_refs": [{"source_id": "source.boi.2011.allen-lane", "locator": "chapter 7 summary, lines 1440-1445; chapter 16 summary, lines 3999-4004", "verification": "checked"}], "lineage": "claim.creativity.explanation-making", "version": 1, "lifecycle": "active"}],
  "arguments": [{"id": "argument.creativity.meme-replication.v1", "stance": "for", "summary": "Because learners cannot directly copy unseen rules or meanings from another mind, reproducing complex cultural knowledge requires creative reconstruction.", "conclusions": ["claim.creativity.explanation-making.v1"], "origin": {"representation": "faithful-paraphrase", "represents": "david-deutsch"}, "source_refs": [{"source_id": "source.boi.2011.allen-lane", "locator": "chapter 16, lines 3857-4004", "verification": "checked"}]}],
  "examples": [],
  "criticisms": [{"id": "criticism.agi.dated-not-test.v1", "stance": "qualifies", "summary": "The source gives a philosophical account and a dated research judgment, not an operational consciousness test or an automatic verdict on later AI systems.", "conclusions": ["claim.creativity.explanation-making.v1"], "origin": {"representation": "editorial-synthesis", "represents": "skill-editor"}, "source_refs": []}],
  "relationships": [
    {"id": "rel.creativity.claim-addresses.v1", "type": "addresses", "from": "claim.creativity.explanation-making.v1", "to": "problem.creativity.new-explanations.v1", "origin": {"representation": "faithful-paraphrase", "represents": "david-deutsch"}, "source_refs": [{"source_id": "source.boi.2011.allen-lane", "locator": "chapters 7 and 16", "verification": "checked"}]},
    {"id": "rel.creativity.argument-argues-for.v1", "type": "argues_for", "from": "argument.creativity.meme-replication.v1", "to": "claim.creativity.explanation-making.v1", "origin": {"representation": "faithful-paraphrase", "represents": "david-deutsch"}, "source_refs": [{"source_id": "source.boi.2011.allen-lane", "locator": "chapter 16, lines 3857-4004", "verification": "checked"}]},
    {"id": "rel.creativity.dated-qualifies.v1", "type": "qualifies", "from": "criticism.agi.dated-not-test.v1", "to": "claim.creativity.explanation-making.v1", "origin": {"representation": "editorial-synthesis", "represents": "skill-editor"}, "source_refs": []}
  ],
  "boundaries": {"misreadings": ["Writing poetry proves consciousness.", "Deutsch's 2011 judgment is automatically his current view.", "Creativity means random variation or style imitation."], "not_for": ["inventing present-tense positions", "consciousness diagnosis"], "decline_if": ["Current empirical AI evaluation is the only issue and no dated worldview claim adds leverage."]}
}
