{
  "schema_version": "1.0.0", "cluster_id": "constructor-theory", "title": "Constructor theory", "status": "active", "application_policy": "source-only",
  "domains": ["constructor-theory", "quantum-physics", "computation"], "explanation_levels": ["fundamental-physical", "domain-theory"],
  "aliases": ["constructor theory", "possible and impossible tasks", "constructor theory of information", "can and can't"], "source_routes": ["source.ct.2013.arxiv-v2", "source.cti.2014.arxiv"],
  "problem": {"id": "problem.constructor.counterfactual-laws.v1", "summary": "Can fundamental laws be formulated through which transformations are possible or impossible and why, rather than only through trajectories of initial states?", "origin": {"representation": "editorial-synthesis", "represents": "skill-editor"}, "source_refs": [], "routing": {"reasoning_jobs": ["define-concept", "understand-worldview", "source-check", "assess-transfer"], "keywords": ["constructor theory", "possible task", "impossible task", "counterfactual", "substrate", "constructor", "information"], "structural_predicates": ["The user asks about the formal constructor-theory program.", "Constructor theory is back-projected into a 1997 book.", "Possible/impossible tasks are used to prove a commercial outcome."], "reject_if": ["proves our margin", "startup playbook"], "diagnostic_questions": ["Which task, substrate, and constructor are defined?", "Is the statement a proposed principle, an explored implication, or an established result?", "Is coauthorship and chronology preserved?"]}},
  "definitions": [],
  "claims": [{"id": "claim.constructor.possible-impossible-program.v1", "summary": "Deutsch's 2012–13 constructor-theory paper proposes expressing fundamental physics through possible and impossible tasks and explores the potential of that counterfactual formulation.", "kind": "conjecture", "scope": "domain-bounded", "transfer_policy": "non-transferable", "origin": {"representation": "faithful-paraphrase", "represents": "david-deutsch"}, "source_refs": [{"source_id": "source.ct.2013.arxiv-v2", "locator": "arXiv abstract and metadata, v2", "verification": "checked"}], "lineage": "claim.constructor.possible-impossible-program", "version": 1, "lifecycle": "active"}],
  "arguments": [{"id": "argument.constructor.counterfactual-explananda.v1", "stance": "for", "summary": "The program is motivated by physical principles and information-like statements whose content concerns transformations that could or could not be performed, including when they do not occur in a trajectory.", "conclusions": ["claim.constructor.possible-impossible-program.v1"], "origin": {"representation": "faithful-paraphrase", "represents": "david-deutsch"}, "source_refs": [{"source_id": "source.ct.2013.arxiv-v2", "locator": "arXiv:1210.7439v2, abstract and introductory formulation", "verification": "checked"}]}],
  "examples": [],
  "criticisms": [{"id": "criticism.constructor.program-not-proof.v1", "stance": "qualifies", "summary": "The source presents a research program and suggested principles, not a settled universal proof; later terminology must not be placed in 1997.", "conclusions": ["claim.constructor.possible-impossible-program.v1"], "origin": {"representation": "editorial-synthesis", "represents": "skill-editor"}, "source_refs": []}, {"id": "criticism.constructor.cti-joint-authorship.v1", "stance": "qualifies", "summary": "Constructor Theory of Information is joint work by David Deutsch and Chiara Marletto and must not be attributed to Deutsch alone.", "conclusions": ["claim.constructor.possible-impossible-program.v1"], "origin": {"representation": "faithful-paraphrase", "represents": "david-deutsch-and-chiara-marletto"}, "source_refs": [{"source_id": "source.cti.2014.arxiv", "locator": "arXiv:1405.5563 title and author metadata", "verification": "checked"}]}],
  "relationships": [
    {"id": "rel.constructor.claim-addresses.v1", "type": "addresses", "from": "claim.constructor.possible-impossible-program.v1", "to": "problem.constructor.counterfactual-laws.v1", "origin": {"representation": "faithful-paraphrase", "represents": "david-deutsch"}, "source_refs": [{"source_id": "source.ct.2013.arxiv-v2", "locator": "arXiv:1210.7439v2, abstract", "verification": "checked"}]},
    {"id": "rel.constructor.argument-argues-for.v1", "type": "argues_for", "from": "argument.constructor.counterfactual-explananda.v1", "to": "claim.constructor.possible-impossible-program.v1", "origin": {"representation": "faithful-paraphrase", "represents": "david-deutsch"}, "source_refs": [{"source_id": "source.ct.2013.arxiv-v2", "locator": "arXiv:1210.7439v2, abstract and introduction", "verification": "checked"}]},
    {"id": "rel.constructor.program-qualifies.v1", "type": "qualifies", "from": "criticism.constructor.program-not-proof.v1", "to": "claim.constructor.possible-impossible-program.v1", "origin": {"representation": "editorial-synthesis", "represents": "skill-editor"}, "source_refs": []},
    {"id": "rel.constructor.cti-authorship-qualifies.v1", "type": "qualifies", "from": "criticism.constructor.cti-joint-authorship.v1", "to": "claim.constructor.possible-impossible-program.v1", "origin": {"representation": "faithful-paraphrase", "represents": "david-deutsch-and-chiara-marletto"}, "source_refs": [{"source_id": "source.cti.2014.arxiv", "locator": "arXiv:1405.5563 title and author metadata", "verification": "checked"}]}
  ],
  "boundaries": {"misreadings": ["Constructor theory was introduced in The Fabric of Reality.", "The 2012 paper proves the completed framework.", "Constructor Theory of Information is Deutsch's sole-authored result.", "Possible tasks prove business feasibility."], "not_for": ["commercial proof", "startup playbook", "management framework"], "decline_if": ["The conclusion depends on transferring technical possibility into another domain."]}
}
