{
  "schema_version": "1.0.0", "cluster_id": "physical-computation-and-proof", "title": "Computation and proof are physical", "status": "active", "application_policy": "source-only",
  "domains": ["computation", "mathematics", "quantum-physics"], "explanation_levels": ["fundamental-physical", "domain-theory"],
  "aliases": ["computation is physical", "Turing principle", "universal quantum computer", "proof is physical", "mathematical fallibilism"], "source_routes": ["source.qc.1985.prs", "source.for.1997.penguin", "source.boi.2011.allen-lane"],
  "problem": {"id": "problem.computation.abstract-versus-physical.v1", "summary": "How do laws of physics constrain what can be computed, simulated, or established by a physical proof?", "origin": {"representation": "editorial-synthesis", "represents": "skill-editor"}, "source_refs": [], "routing": {"reasoning_jobs": ["understand-worldview", "define-concept", "source-check", "criticize"], "keywords": ["computation", "computer", "Turing principle", "universal computer", "quantum computer", "mathematics", "proof", "decidable"], "structural_predicates": ["Computation is treated as wholly abstract and independent of physical law.", "A technical universality result is transferred into a life or business algorithm.", "Proof is confused with infallible human knowledge."], "reject_if": ["career algorithm", "management system"], "diagnostic_questions": ["What physical repertoire is claimed?", "Which version of the Turing principle is in play?", "Does the claim concern mathematical truth, a proof process, or our fallible knowledge of it?"]}},
  "definitions": [],
  "claims": [{"id": "claim.computation.physical-principle.v1", "summary": "Deutsch treats computation as a physical process whose possible repertoire and efficiency depend on the laws of physics; he likewise treats proof as physically instantiated and mathematical knowledge as fallible.", "kind": "explanatory-theory", "scope": "domain-bounded", "transfer_policy": "non-transferable", "origin": {"representation": "faithful-paraphrase", "represents": "david-deutsch"}, "source_refs": [{"source_id": "source.for.1997.penguin", "locator": "chapters 6, 9, and 10; chapter 10 summary, lines 7952-7972", "verification": "checked"}, {"source_id": "source.qc.1985.prs", "locator": "journal paper abstract and sections 1-2", "verification": "checked"}], "lineage": "claim.computation.physical-principle", "version": 1, "lifecycle": "active"}],
  "arguments": [{"id": "argument.computation.universal-simulator.v1", "stance": "for", "summary": "A physically possible universal simulator would reproduce every physically possible process in its domain, linking comprehensibility and computation to actual physical law rather than to syntax alone.", "conclusions": ["claim.computation.physical-principle.v1"], "origin": {"representation": "faithful-paraphrase", "represents": "david-deutsch"}, "source_refs": [{"source_id": "source.for.1997.penguin", "locator": "chapter 6 summary, lines 4327-4342", "verification": "checked"}]}],
  "examples": [],
  "criticisms": [{"id": "criticism.computation.not-life-algorithm.v1", "stance": "qualifies", "summary": "Physical computation theory does not provide a career-choice algorithm, prove a management design, or make every mathematical theorem uncertain in the same sense.", "conclusions": ["claim.computation.physical-principle.v1"], "origin": {"representation": "editorial-synthesis", "represents": "skill-editor"}, "source_refs": []}, {"id": "criticism.computation.boi-errata-controls.v1", "stance": "qualifies", "summary": "Deutsch's official errata materially corrects the book's edition-sensitive discussion of Gödel, so analysis of those pages must use the correction rather than the uncorrected wording alone.", "conclusions": ["claim.computation.physical-principle.v1"], "origin": {"representation": "faithful-paraphrase", "represents": "david-deutsch"}, "source_refs": [{"source_id": "source.boi.errata.official", "locator": "correction for pages 184-185", "verification": "checked"}]}],
  "relationships": [
    {"id": "rel.computation.claim-addresses.v1", "type": "addresses", "from": "claim.computation.physical-principle.v1", "to": "problem.computation.abstract-versus-physical.v1", "origin": {"representation": "faithful-paraphrase", "represents": "david-deutsch"}, "source_refs": [{"source_id": "source.for.1997.penguin", "locator": "chapters 6, 9, and 10", "verification": "checked"}]},
    {"id": "rel.computation.argument-argues-for.v1", "type": "argues_for", "from": "argument.computation.universal-simulator.v1", "to": "claim.computation.physical-principle.v1", "origin": {"representation": "faithful-paraphrase", "represents": "david-deutsch"}, "source_refs": [{"source_id": "source.for.1997.penguin", "locator": "chapter 6 summary, lines 4327-4342", "verification": "checked"}]},
    {"id": "rel.computation.algorithm-qualifies.v1", "type": "qualifies", "from": "criticism.computation.not-life-algorithm.v1", "to": "claim.computation.physical-principle.v1", "origin": {"representation": "editorial-synthesis", "represents": "skill-editor"}, "source_refs": []},
    {"id": "rel.computation.errata-qualifies.v1", "type": "qualifies", "from": "criticism.computation.boi-errata-controls.v1", "to": "claim.computation.physical-principle.v1", "origin": {"representation": "faithful-paraphrase", "represents": "david-deutsch"}, "source_refs": [{"source_id": "source.boi.errata.official", "locator": "correction for pages 184-185", "verification": "checked"}]}
  ],
  "boundaries": {"misreadings": ["The Turing principle is only an abstract theorem.", "Quantum decision theory chooses careers.", "Fallible mathematical knowledge invalidates proofs."], "not_for": ["life algorithm", "business metaphor"], "decline_if": ["No physical or mathematical computation question remains."]}
}
