{
  "schema_version": "1.0.0", "cluster_id": "realism-emergence-abstraction", "title": "Realism, emergence, and abstractions", "status": "active",
  "domains": ["worldview", "epistemology"], "explanation_levels": ["worldview-meta", "emergent"],
  "aliases": ["reality of abstractions", "emergence", "levels of explanation", "reductionism", "kicks back"], "source_routes": ["source.for.1997.penguin", "source.boi.2011.allen-lane"],
  "problem": {"id": "problem.reality.levels.v1", "summary": "Which explanatory entities and levels should be treated as real rather than dismissed as mere lower-level physics or arbitrary description?", "origin": {"representation": "editorial-synthesis", "represents": "skill-editor"}, "source_refs": [], "routing": {"reasoning_jobs": ["understand-worldview", "evaluate-explanation", "criticize"], "keywords": ["real", "reductionism", "holism", "emergence", "abstraction", "causation", "level"], "structural_predicates": ["A higher-level explanation is dismissed solely because lower-level components exist.", "A holistic description is treated as the only legitimate level."], "reject_if": ["ordinary database abstraction"], "diagnostic_questions": ["At what level does the autonomous explanatory pattern appear?", "What does the proposed entity do that kicks back against our expectations?"]}},
  "definitions": [],
  "claims": [{"id": "claim.explanations.no-single-hierarchy.v1", "summary": "Reductionism and holism are both inadequate as universal doctrines; explanations at emergent levels can be fundamental to the problems they solve, and abstractions can be real and causally relevant.", "kind": "explanatory-theory", "scope": "domain-bounded", "transfer_policy": "bridge-required", "origin": {"representation": "faithful-paraphrase", "represents": "david-deutsch"}, "source_refs": [{"source_id": "source.boi.2011.allen-lane", "locator": "chapter 5 summary, lines 1136-1141", "verification": "checked"}], "lineage": "claim.explanations.no-single-hierarchy", "version": 1, "lifecycle": "active"}],
  "arguments": [{"id": "argument.fabric.includes-emergents.v1", "stance": "for", "summary": "Life, thought, and computation have autonomous explanatory facts and must be included in an integrated account of reality rather than treated as dispensable descriptions.", "conclusions": ["claim.explanations.no-single-hierarchy.v1"], "origin": {"representation": "faithful-paraphrase", "represents": "david-deutsch"}, "source_refs": [{"source_id": "source.for.1997.penguin", "locator": "chapter 1 summary, lines 1007-1033", "verification": "checked"}]}],
  "examples": [],
  "criticisms": [{"id": "criticism.emergence.not-magic.v1", "stance": "qualifies", "summary": "Autonomous higher-level explanation does not license ignoring lower-level constraints or calling every useful abstraction physically fundamental.", "conclusions": ["claim.explanations.no-single-hierarchy.v1"], "origin": {"representation": "editorial-synthesis", "represents": "skill-editor"}, "source_refs": []}],
  "relationships": [
    {"id": "rel.emergence.claim-addresses.v1", "type": "addresses", "from": "claim.explanations.no-single-hierarchy.v1", "to": "problem.reality.levels.v1", "origin": {"representation": "faithful-paraphrase", "represents": "david-deutsch"}, "source_refs": [{"source_id": "source.boi.2011.allen-lane", "locator": "chapter 5 summary, lines 1136-1141", "verification": "checked"}]},
    {"id": "rel.emergence.argument-argues-for.v1", "type": "argues_for", "from": "argument.fabric.includes-emergents.v1", "to": "claim.explanations.no-single-hierarchy.v1", "origin": {"representation": "faithful-paraphrase", "represents": "david-deutsch"}, "source_refs": [{"source_id": "source.for.1997.penguin", "locator": "chapter 1 summary, lines 1007-1033", "verification": "checked"}]},
    {"id": "rel.emergence.magic-qualifies.v1", "type": "qualifies", "from": "criticism.emergence.not-magic.v1", "to": "claim.explanations.no-single-hierarchy.v1", "origin": {"representation": "editorial-synthesis", "represents": "skill-editor"}, "source_refs": []}
  ],
  "boundaries": {"misreadings": ["Higher-level explanations violate physics.", "The lowest-level description is always the best explanation.", "Every abstraction is objectively real."], "not_for": ["evading material constraints"], "decline_if": ["The relevant level is already clear and uncontested."]}
}
